study_id	authors	title	year	doi	nber_phenotypes	comment	description	categories	status	flybase_ref
39	Harbison et al.	Genome-Wide Association Study of Circadian Behavior in <i>Drosophila melanogaster</i>	2018	10.1007/s10519-018-9932-0	3	Phenotyping data comes from <b>Table S2</b> found in the <b>Supplementary material 3</b> of the <a href="https://link.springer.com/article/10.1007/s10519-018-9932-0#Sec25">Electronic Supplementary Material</a> section.<br/><br/> <b>Table S12</b> contains some gene expression data for one DGRP line, but the data seem not deposited in SRA or a gene expression repository. Thus, this data is not included here.<br/><br/> NA values in the periodic data stands for arrhythmic flies. The authors observed that ~ 12% of the flies were arrhythmic.	Circadian rhythms influence physiological processes from sleep–wake cycles to body temperature and are controlled by highly conserved cycling molecules. The authors measured the circadian period (Ʈ) and rhythmicity index in the DGRP. Seven DGRP lines had sexually dimorphic arrhythmicity and one line had an exceptionally long circadian period Ʈ.	Behaviour,Life history traits,Sleep	integrated	FBrf0241121
40	Huang et al.	Context-dependent genetic architecture of Drosophila life span	2020	10.1371/journal.pbio.3000645	6	Phenotyping data are available from the <a href="https://doi.org/10.1371/journal.pbio.3000645.s001">S1 table</a> found in the <a href="https://journals.plos.org/plosbiology/article?id=10.1371/journal.pbio.3000645#sec019">Supporting information</a> section. <b>Of note</b>, raw data is also available from <a href="https://github.com/qgg-lab/dgrp-lifespan/">GitHub</a>, so we primarily uploaded this data, instead of the summarized data.<br/><br/> The authors also created an Advanced Intercross Population (AIP) from a subset of extreme long-living DGRP lines that were maintained for over 100 generations with a large effective population size before performing “extreme quantitative trait locus (xQTL)” mapping for life span.	In this study, the authors quantified variation in life span in males and females reared in 3 thermal environments. Quantitative genetic analyses of life span and the micro-environmental variance of life span in the DGRP revealed significant genetic variance for both traits within each sex and environment, as well as significant genotype-by-sex interaction (GSI) and genotype-by-environment interaction (GEI). We only kept the micro-environmental variance (ln<i>σ</i><sub>ε</sub>) summary calculation from the authors, but it's a simple logarithmic transformation of the standard deviation.	Evolution,Life history traits,Ageing	integrated	FBrf0245198
41	Watanabe et al.	Exercise-induced changes in climbing performance	2021	10.1098/rsos.211275	2	Phenotyping data were extracted from <b>Table S1</b>, available on <a href="https://doi.org/10.6084/m9.figshare.c.5696157">Figshare</a>.<br/><br/> The exercise-treated flies were subjected to 2h/day exercise session (exercising in response to rotational stimulation on a Treadwheel), for 5 days. Physical fitness in the exercise-treated and control animals was assayed using a rapid iterative negative geotaxis (RING) assay to determine a climbing index for each fly line. With this measure, a larger climbing index indicates that the flies were able to climb the vial walls faster after having been knocked to the bottom of the enclosure (range of possible climbing indexes: 1–4).	The authors investigated how the climbing ability changes in response to a regular exercise schedule. They found extensive variation in baseline climbing ability and exercise-induced changes. Climbing ability, and its exercise-induced change, are sex- and genotype-dependent.	Life history traits,Locomotion	integrated	FBrf0251956
42	Hope et al.	The Drosophila Gene <i>Sulfateless</i> Modulates Autism-Like Behaviors	2019	10.3389/fgene.2019.00574	6	Mean phenotyping data were downloaded from <b>Supplemental Data 1</b> found in the <a href="https://www.frontiersin.org/articles/10.3389/fgene.2019.00574/full#supplementary-material">Supplementary material</a> section. Of note, we rather used the raw phenotyping data available in <b>Supplemental Data 4</b>.	This study investigates autism spectrum disorder (ASD) risk, through three phenotypes with analogous behavior domains: impaired social communication, social reciprocity and repetitive behaviors or restricted interests. They studied ASD gene orthologs (<i>neurexin 4</i> and <i>neuroligin 2</i>), an intellectual disability (ID) gene homolog (<i>kirre</i>), and a gene encoding a heparan sulfate (HS) modifying enzyme called <i>sulfateless</i> (<i>sfl</i>). SNPs in <i>sfl</i> were associated with all three ASD-like behaviors. 	Behaviour,Life history traits	accepted	FBrf0242954
43	Rohde et al.	Genetic Signatures of Drug Response Variability in <i>Drosophila melanogaster</i>	2019	10.1534/genetics.119.302381	4	The control treatment (SUC) consisted of a 5% sucrose solution (with 5% green food dye) and the MPH treatment was a 5% sucrose solution (with 5% green food dye) containing 1.5 mg ml−1 MPH (Sigma [Sigma Chemical], St. Louis, MO).<br/> Phenotyping data were downloaded from the <b>data_file_S1.csv</b> file accessible in the supplemental material available at <a href="https://doi.org/10.25386/genetics.9368636">Figshare</a>.	This study explores the response to methylphenidate (MPH), a drug used in the treatment of attention-deficit/hyperactivity disorder. The authors exposed DGRPs to MPH and control treatment and observed an increase in locomotor activity in MPH-exposed individuals. Based on the DGRP, they showed that the behavioral response to MPH was strongly genotype-dependent.	Behaviour,Locomotion	integrated	FBrf0243724
44	Zhao et al.	The metabolome as a biomarker of aging in <i>Drosophila melanogaster</i>	2022	10.1111/acel.13548	15		This study followed adult cohorts of 20 DGRP strains chosen to represent the breadth of lifespan variation. They phenotyped lifespan, baseline mortality, and rate of aging and associated these parameters with age-specific functional traits including fecundity, climbing activity, and age-specific targeted metabolomic profiles. They show that activity levels and metabolome-wide profiles are strongly associated with age, that numerous individual metabolites show a strong association with lifespan, and that the metabolome provides a biological clock that predicts not only sample age but also future mortality rates and lifespan.	Behaviour,Life history traits,Ageing	accepted	FBrf0252669
45	Chi et al.	RNA-binding protein syncrip regulates starvation-induced hyperactivity in adult Drosophila	2021	10.1371/journal.pgen.1009396	5			Behaviour	accepted	FBrf0248324
46	Frochaux et al.	cis-regulatory variation modulates susceptibility to enteric infection in the Drosophila genetic reference panel	2020	10.1186/s13059-019-1912-z	1			Immunity	accepted	FBrf0244562
47	Ørsted et al.	Environmental variation partitioned into separate heritable components	2017	10.1111/evo.13391	17	Of note, the inversion and <i>Wolbachia pipientis</i> phenotypes are coming from <a href="https://dgrpool.epfl.ch/studies/17">Huang et al, 2014</a>		Genome architecture,Resistance	accepted	FBrf0237717
48	Lavoy et al.	Genetic Modifiers of Neurodegeneration in a <i>Drosophila<i> Model of Parkinson’s Disease	2018	10.1534/genetics.118.301119	10			Behaviour	accepted	FBrf0239578
49	Salvador-MartÃ­nez et al.	Mapping Selection within Drosophila melanogaster Embryo’s Anatomy	2017	10.1093/molbev/msx266	0			Development,Anatomy,Appearance	accepted	FBrf0237601
50	HorvÃ¡th et al.	A novel method for quantifying the rate of embryogenesis uncovers considerable genetic variation for the duration of embryonic development in Drosophila melanogaster	2016	10.1186/s12862-016-0776-z	0			Development	accepted	FBrf0233634
51	Morozova et al.	A <i>Cyclin E</i>Centered Genetic Network Contributes to Alcohol-Induced Variation in Drosophila Development	2018	10.1534/g3.118.200260	0			Sensory,Development,Behaviour	accepted	FBrf0239702
52	Litovchenko et al.	Extensive tissue-specific expression variation and novel regulators underlying circadian behavior	2021	10.1126/sciadv.abc3781	0			Behaviour	accepted	FBrf0247917
53	He et al.	Epistatic partners of neurogenic genes modulate Drosophila olfactory behavior	2016	10.1111/gbb.12279	3			Behaviour	accepted	FBrf0230854
54	Francis et al.	Genome wide analysis in <i>Drosophila<i> reveals diet by gene interactions and uncovers diet-responsive genes	2019	10.1101/718304	0			Resistance,Metabolism	accepted	
55	Akhund-Zade et al.	Genetic basis of offspring number–body weight tradeoff in <i>Drosophila melanogaster</i>	2021	10.1093/g3journal/jkab129	0			Life history traits	accepted	
56	Campbell et al.	Genome-Wide Association Analysis of Anoxia Tolerance in <i>Drosophila melanogaster</i>	2019	10.1534/g3.119.400421	3			Resistance	accepted	FBrf0243370
57	Spierer et al.	Natural variation in the regulation of neurodevelopmental genes modifies flight performance in Drosophila	2021	10.1371/journal.pgen.1008887	1			Behaviour	accepted	FBrf0248437
58	Rodrigues et al.	The genetic basis and adult reproductive consequences of developmental thermal plasticity	2022	10.1111/1365-2656.13664	18			Life history traits	accepted	FBrf0253732
59	Lovejoy et al.	Genetic basis of susceptibility to low‐dose paraquat and variation between the sexes in <i>Drosophila melanogaster</i>	2021	10.1111/mec.15878	65			Sensory,Behaviour	accepted	FBrf0248852
60	Huang et al.	Epistasis dominates the genetic architecture of <i>Drosophila</i> quantitative traits	2012	10.1073/pnas.1213423109	0			Life history traits	accepted	FBrf0219551
61	Dembeck et al.	Genetic basis of natural variation in body pigmentation in <i>Drosophila melanogaster</i>	2015	10.1080/19336934.2015.1102807	5			Appearance	accepted	FBrf0230671
62	Swarup et al.	Analysis of natural variation reveals neurogenetic networks for <i>Drosophila</i> olfactory behavior	2012	10.1073/pnas.1220168110	0			Sensory	accepted	FBrf0220538
63	Duneau et al.	Signatures of insecticide selection in the genome of <i>Drosophila melanogaster</i>	2018	10.1101/287250	15			Resistance	accepted	
64	Morgante et al.	Leveraging multiple layers of data to predict <i>Drosophila</i> complex traits	2019	10.1101/824896	0				accepted	
65	Wang et al.	Genetic variation for resistance to the specific fly pathogen Entomophthora muscae	2020	10.1038/s41598-020-71262-w	16			Immunity,Resistance	accepted	FBrf0246635
66	Garud et al.	Detection of hard and soft selective sweeps from Drosophila melanogaster population genomic data	2021	10.1371/journal.pgen.1009373	0			Genome architecture	accepted	FBrf0248389
67	Baker et al.	Genetic Basis of Variation in Cocaine and Methamphetamine Consumption in Outbred Populations of <i>Drosophila melanogaster</i>	2021	10.1101/2021.03.01.433403	0			Sensory,Behaviour	accepted	
68	Zhang et al.	Testing Implications of the Omnigenic Model for the Genetic Analysis of Loci Identified through Genome-wide Association	2021	10.1016/j.cub.2020.12.023	0			Appearance	accepted	FBrf0248411
69	Patel et al.	Identification of genetic modifiers of lifespan on a high sugar diet in the Drosophila Genetic Reference Panel	2021	10.1016/j.heliyon.2021.e07153	1			Life history traits	accepted	FBrf0249297
70	Zhang et al.	Identification of a genetic network for an ecologically relevant behavioural phenotype in <i>Drosophila melanogaster</i>	2020	10.1111/mec.15341	0			Anatomy	accepted	FBrf0244858
71	Yanagawa et al.	Genetic Basis of Natural Variation in Spontaneous Grooming in <i>Drosophila melanogaster</i>	2020	10.1534/g3.120.401360	0			Behaviour	accepted	FBrf0246612
72	Knudsen et al.	Genetic Variation and Potential for Resistance Development to the tTA Overexpression Lethal System in Insects	2020	10.1534/g3.120.400990	0			Genome architecture,Life history traits	accepted	FBrf0245357
73	Rohde et al.	Functional Validation of Candidate Genes Detected by Genomic Feature Models	2018	10.1534/g3.118.200082	1			Behaviour	accepted	FBrf0238818
74	Adebambo et al.	Toxicological Study and Genetic Basis of BTEX Susceptibility in Drosophila melanogaster	2020	10.3389/fgene.2020.594179	0			Development,Resistance	accepted	FBrf0247219
75	Bou Sleiman et al.	Enteric infection induces Lark-mediated intron retention at the 5′ end of Drosophila genes	2020	10.1186/s13059-019-1918-6	2			Genome architecture,Immunity	accepted	FBrf0244561
76	Lafuente et al.	Genetic basis of thermal plasticity variation in <i>Drosophila melanogaster</i>body size	2018	10.1101/268201	3			Appearance	accepted	
77	Ahlers et al.	Insulin potentiates JAK/STAT signaling to broadly inhibit flavivirus replication in insect vectors	2019	10.1101/701714	0			Immunity,Metabolism	accepted	
78	Watanabe et al.	Genetic networks underlying natural variation in basal and induced activity levels in <i>Drosophila melanogaster</i>	2018	10.1101/444380	3			Behaviour	accepted	
79	Evangelou et al.	Unpredictable effects of the genetic background of transgenic lines in physiological quantitative traits	2018	10.1101/494419	6			Life history traits,Metabolism	accepted	
80	Dean et al.	Masculinization of gene expression is associated with male quality in <i>Drosophila melanogaster</i>	2018	10.1111/evo.13618	5			Behaviour,Life history traits	accepted	FBrf0240924
81	Gao et al.	Incorporating Gene Annotation into Genomic Prediction of Complex Phenotypes	2017	10.1534/genetics.117.300198	0			Sensory,Behaviour,Metabolism	accepted	FBrf0236841
82	Signor et al.	A Large Panel of Drosophila simulans Reveals an Abundance of Common Variants	2017	10.1093/gbe/evx262	0			Evolution	accepted	FBrf0237786
83	Schmidt et al.	Insights into DDT Resistance from the <i>Drosophila melanogaster<i> Genetic Reference Panel	2017	10.1534/genetics.117.300310	0			Genome architecture,Resistance	accepted	FBrf0237089
84	Riddle	Variation in the response to exercise stimulation in Drosophila: marathon runner versus sprinter genotypes	2020	10.1242/jeb.229997	5			Behaviour	accepted	FBrf0246800
85	Harrison et al.	The metabolome as a link in the genotype-phenotype map for peroxide resistance in the fruit fly, Drosophila melanogaster	2020	10.1186/s12864-020-6739-1	59			Resistance,Metabolism	accepted	FBrf0245603
86	Massey et al.	Pleiotropic effects of <i>ebony</i>and <i>tan</i>on pigmentation and cuticular hydrocarbon composition in <i>Drosophila melanogaster</i>	2019	10.1101/538090	0			Appearance	accepted	
87	Gabrawy et al.	Lisinopril Preserves Physical Resilience and Extends Life Span in a Genotype-Specific Manner in Drosophila melanogaster	2019	10.1093/gerona/glz152	0			Sensory,Life history traits	accepted	FBrf0244035
88	Champer et al.	CRISPR Gene Drive Efficiency and Resistance Rate Is Highly Heritable with No Common Genetic Loci of Large Effect	2019	10.1534/genetics.119.302037	0			Genome architecture,Evolution	accepted	FBrf0242214
89	Bonfini et al.	Multiscale analysis reveals that diet-dependent midgut plasticity emerges from alterations in both stem cell niche coupling and enterocyte size	2021	10.7554/elife.64125	13			Organ Size,Development,Metabolism	accepted	
90	Manoel et al.	Beta-blockers in Traumatic Brain Injury	2018	10.5005/jp-journals-10030-1241	0				accepted	
91	Kumar et al.	Identification of Genes Contributing to a Long Circadian Period in <i>Drosophila Melanogaster</i>	2020	10.1177/0748730420975946	0			Genome architecture	accepted	FBrf0248902
92	Guzman et al.	Natural genetic variation in <i>Drosophila melanogaster<i> reveals genes associated with <i>Coxiella burnetii<i> infection	2021	10.1093/genetics/iyab005	0			Immunity	accepted	FBrf0248571
93	Ma et al.	Commensal Gut Bacteria Buffer the Impact of Host Genetic Variants on Drosophila Developmental Traits under Nutritional Stress	2019	10.1016/j.isci.2019.07.048	0			Development,Limb Development,Appearance	accepted	FBrf0243652
94	McCracken et al.	The hidden costs of dietary restriction: implications for its evolutionary and mechanistic origins	2019	10.1101/533711	0			Life history traits	accepted	
95	Rohde et al.	Genotype and Trait Specific Responses to Rapamycin Intake in Drosophila melanogaster	2021	10.3390/insects12050474	2			Life history traits,Resistance	accepted	FBrf0249203
96	Hall et al.	Identification of novel genes associated with longevity in Drosophila melanogaster - a computational approach	2019	10.18632/aging.102527	0			Genome architecture,Life history traits	accepted	FBrf0244333
97	Pitchers et al.	A Multivariate Genome-Wide Association Study of Wing Shape in <i>Drosophila melanogaster</i>	2019	10.1534/genetics.118.301342	0			Limb Development	accepted	FBrf0242020
98	Green et al.	 <i>Cis</i>and <i>trans</i>-acting variants contribute to survivorship in a naïve <i>Drosophila melanogaster</i>population exposed to ryanoid insecticides	2018	10.1101/502161	7			Resistance,Metabolism	accepted	
99	Battlay et al.	Structural Variants and Selective Sweep Foci Contribute to Insecticide Resistance in the <i>Drosophila</i>Genetic Reference Panel	2018	10.1534/g3.118.200619	0			Genome architecture,Resistance	accepted	FBrf0240570
100	Jin et al.	Genetic and metabolomic architecture of variation in diet restriction-mediated lifespan extension in Drosophila	2020	10.1371/journal.pgen.1008835	0			Life history traits,Metabolism	accepted	FBrf0246151
101	Jehrke et al.	The impact of genome variation and diet on the metabolic phenotype and microbiome composition of Drosophila melanogaster	2018	10.1038/s41598-018-24542-5	0			Microbiota,Metabolism	accepted	FBrf0238766
102	Rajpurohit et al.	Spatiotemporal dynamics and genome-wide association analysis of desiccation tolerance in <i>Drosophila melanogaster</i>	2018	10.1111/mec.14814	19			Resistance,Metabolism	accepted	FBrf0239872
103	Wilson et al.	GWAS for Lifespan and Decline in Climbing Ability in Flies upon Dietary Restriction Reveal decima as a Mediator of Insulin-like Peptide Production	2020	10.1016/j.cub.2020.05.020	0			Behaviour,Life history traits,Metabolism	accepted	FBrf0246266
104	McCracken et al.	The relationship between longevity and diet is genotype dependent and sensitive to desiccation in <i>Drosophila melanogaster</i>	2020	10.1242/jeb.230185	0			Life history traits	accepted	FBrf0247456
105	Freda et al.	Stage-specific genotype-by-environment interactions for cold and heat hardiness in Drosophila melanogaster	2019	10.1038/s41437-019-0236-9	6			Development,Resistance	accepted	FBrf0243444
106	Okada et al.	Sex‐dependent and sex‐independent regulatory systems of size variation in natural populations	2019	10.15252/msb.20199012	3			Appearance	accepted	FBrf0244128
107	Rolandi et al.	Genetic variation for tolerance to high temperatures in a population of <i>Drosophila melanogaster</i>	2018	10.1002/ece3.4409	3			Resistance	accepted	FBrf0240724
108	Bryant et al.	The Intracellular Symbiont <i>Wolbachia pipientis</i> Enhances Recombination in a Dose-Dependent Manner	2020	10.3390/insects11050284	0			Genome architecture	accepted	FBrf0245608
109	Sharma et al.	Musashi expression in intestinal stem cells attenuates radiation-induced decline in intestinal permeability and survival in <i>Drosophila</i>	2020	10.1038/s41598-020-75867-z	0			Resistance	accepted	FBrf0247145
110	Scharenbrock et al.	Interactions among Genetic Background, Anesthetic Agent, and Oxygen Concentration Shape Blunt Traumatic Brain Injury Outcomes in <i>Drosophila melanogaster</i>	2020	10.3390/ijms21186926	0			Behaviour	accepted	FBrf0246825
111	Newell et al.	The <i>Drosophila</i> Post-mating Response: Gene Expression and Behavioral Changes Reveal Perdurance and Variation in Cross-Tissue Interactions	2020	10.1534/g3.119.400963	0			Behaviour	accepted	FBrf0245057
112	Palu et al.	Decoupling of Apoptosis from Activation of the ER Stress Response by the <i>Drosophila</i> Metallopeptidase <i>superdeath</i>	2020	10.1534/genetics.119.303004	0			Appearance	accepted	FBrf0245428
113	Davis et al.	Characterizing dopaminergic neuron vulnerability using genome-wide analysis	2021	10.1093/genetics/iyab081	1			Behaviour	accepted	FBrf0252031
114	Masson et al.	Blind killing of both male and female <i>Drosophila<i> embryos by a natural variant of the endosymbiotic bacterium <i>Spiroplasma poulsonii</i>	2020	10.1111/cmi.13156	0			Development,Life history traits,Immunity	accepted	FBrf0245270
115	Savola et al.	Testing evolutionary explanations for the lifespan benefit of dietary restriction in fruit flies ( <i>Drosophila melanogaster<i> )	2021	10.1111/evo.14146	0			Life history traits	accepted	FBrf0248261
116	Siva-Jothy et al.	Dissecting genetic and sex-specific sources of host heterogeneity in pathogen shedding and spread	2021	10.1371/journal.ppat.1009196	0			Life history traits,Immunity	accepted	FBrf0247956
117	Amstutz et al.	Cluster-Based Analysis of Retinitis Pigmentosa Modifiers Using Drosophila Eye Size and Gene Expression Data	2022	10.3390/genes13020386	0			Appearance	accepted	FBrf0252765
118	Schiffman et al.	Ageing and genetic background influence anaesthetic effects in a <i>D. melanogaster</i> model of blunt trauma with brain injury†	2020	10.1016/j.bja.2020.03.029	0			Life history traits,Ageing	accepted	FBrf0245944
119	Chen et al.	Female genetic contributions to sperm competition in <i>Drosophila melanogaster</i>	2018	10.1101/500546	0			Life history traits	accepted	
120	Hoffman et al.	Sex, mating and repeatability of <i>Drosophila melanogaster</i> longevity	2021	10.1098/rsos.210273	16			Life history traits,Ageing	accepted	FBrf0250359
121	Siva-Jothy et al.	Viral infection causes sex-specific changes in fruit fly social aggregation behaviour	2019	10.1098/rsbl.2019.0344	0			Behaviour	accepted	FBrf0243480
122	Brown et al.	Behavioral and Transcriptional Response to Selection for Olfactory Behavior in <i>Drosophila</i>	2020	10.1534/g3.120.401117	0			Sensory,Behaviour	accepted	FBrf0245363
130	Ayroles et al.	Systems genetics of complex traits in Drosophila melanogaster	2009	10.1038/ng.332	0				submitted	
131	Morozova et al.	Alcohol Sensitivity in Drosophila: Translational Potential of Systems Genetics	2009	10.1534/genetics.109.107490	0				submitted	
132	Morozova et al.	Modulation of the Drosophila transcriptome by developmental exposure to alcohol	2022	10.1186/s12864-022-08559-9	0				submitted	
133	Palmer et al.	Isolation of a natural DNA virus of Drosophila melanogaster, and characterisation of host resistance and immune responses	2018	10.1371/journal.ppat.1007050	0				submitted	
134	Saha et al.	Genetic architecture of natural variation of cardiac performance from flies to humans	2022	10.7554/eLife.82459	0				submitted	
135	Sidisky et al.	Genome-wide analysis reveals novel regulators of synaptic maintenance in <i>Drosophila</i>	2023	10.1093/genetics/iyad025	0				submitted	
136	Patlar et al.	A predominant role of genotypic variation in both expression of sperm competition genes and paternity success in <i>Drosophila melanogaster</i>	2023	10.1098/rspb.2023.1715	0				submitted	
137	Ãzsoy et al.	Epistasis for head morphology in <i>Drosophila melanogaster</i>	2021	10.1093/g3journal/jkab285	0				submitted	
138	Wong et al.	Pleiotropic fitness effects across sexes and ages in the <i>Drosophila<i> genome and transcriptome	2023	10.1093/evolut/qpad163	0				submitted	
139	CannavÃ² et al.	Genetic variants regulating expression levels and isoform diversity during embryogenesis	2016	10.1038/nature20802	0				submitted	
140	Leiva et al.	Intraspecific variation of heat tolerance in a model ectotherm: The role of oxygen, cell size and body size	2023	10.1111/1365-2435.14485	0				submitted	
141	Leiva et al.	The role of cell size in shaping responses to oxygen and temperature in fruit flies	2023	10.1111/1365-2435.14294	0				submitted	
142	Dobson et al.	Host genetic determinants of microbiota-dependent nutrition revealed by genome-wide analysis of <i>Drosophila melanogaster</i>	2015	10.1038/ncomms7312	1	Despite being a study about microbiota-dependent nutrition, we could not find any other phenotypes than the Wolbachia Status in this study?<br/> <br/> Phenotyping data is available from Supp Table S6 in <a href="https://www.nature.com/articles/ncomms7312#Sec14">supplementary data</a> section.	This study examined the genetic basis for how gut microbiota affect five nutritional traits (weight, protein, lipid, glucose, and glycogen contents) in fruit flies. The authors found significant genotype-dependent variations in these traits when the microbiota were eliminated, identifying specific genetic polymorphisms associated with these variations and validating key genes involved in these microbiota-dependent nutritional effects. Additionally, they observed that the presence of the intracellular bacterium Wolbachia influenced glycogen content, with Wolbachia-positive lines showing higher glycogen levels compared to Wolbachia-free lines.	Microbiota,Metabolism,Nutrition	integrated	
